{
  "$schema": "http://json-schema.org/draft-07/schema#",
  "title": "Stamen Terrain",
  "description": "",
  "type": "object",
  "properties": {
    "id": {
      "type": "string",
      "minLength": 1
    },
    "name": {
      "type": "string",
      "minLength": 1
    },
    "description": {
      "type": "string"
    },
    "attribution": {
      "type": "string"
    },
    "url": {
      "type": "string",
      "minLength": 1
    },
    "position": {
      "type": "string",
      "enum": ["basemap", "overlay"]
    }
  },
  "required": ["id", "name", "description", "url"],
  "additionalProperties": false
}
